NUIsources,"ref, type","ref, origine","Auteur, nom, prénom (dates)","Ouvrage, titre","Ouvrage, date de publication","ouvrage, ref d'édition","espace, mtq couvert","espace, nom des autres espaces couverts",où consulter sur le web,Notes,Plante(s) recherchée(s) - n° d'après le NUI_plante
nui_sou_00001,archives,article Lozere,"Descourtilz, Michel-Étienne (1777-1838) ","Flore médicale des Antilles, ou Traité des plantes usuelles des colonies françaises, anglaises, espagnoles, portugaises",1821-1827 ; 1833,"A Paris : Chez l'Éditeur, rue du 29 juillet, Vol. 4-8 publiés ""Chez Rousselon"".",,Antilles,http://www.manioc.org/patrimon/FCL18021 et FCL18022 à 28,//JPL La recherche d'Alpinia Zerumbeth n'a pas l'air de renvoyer de résultat pertinent,"/JPL 6, 13, 26, 44, 45, 48, 49, 50, 55, 56, 70"
nui_sou_00002,archives,article Lozere,"Nicolson, Bartholomaeus (17..-....) ",Essai sur l’Histoire naturelle à Saint-Domingue,1776,Paris : chez Gobreau,,Saint-Domingue,http://www.manioc.org/patrimon/HASH011018184feb42c708996ebb,"// plantes mentionnées, mais intérêt faible pour notre étude ","/JPL 6,13, 26, 44, 45, 48, 49, 50, 55, 57, 70"
nui_sou_00003,archives,manioc,"Duss, Antoine (1840-1924)",Flore phanérogamique des Antilles françaises : Martinique et Guadeloupe,1897,Macon : Protat frères,Martinique,Antilles ; Guadeloupe,http://www.manioc.org/patrimon/SCH13269,// Duss s'appuie en partie sur Descourtilz,"/JPL 6, 13, 26, 44, 45, 48, 49, 50, 55, 58, 70"
nui_sou_00004,archives,manioc,"Jacquin, von, Nikolaus Joseph (1727-1817)","Selectarum stirpium Americanarum historia in qua ad Linnaeanum systema determinatae descriptaeque sistuntur plantae illae, quas in insulis Martinica, Jamaica, Domingo, allisque, et in vicina continentis parte observavit rariores",1788,Manhemii : in Bibliopolio Novo Aul. & Acad.,Martinique,Jamaïque ; Antilles ;,http://www.manioc.org/patrimon/ADG17051,// En latin ; capriaria p. 233 ; petivera p. 127 ; portulaca p. 186 (mais pas oleracae il semble) ; de même Alpinia p. 1 (mais pas Zerumbet),"/JPL 13, 26, 44, 45, 48, 49, 50, 55, 59"
nui_sou_00005,archives,manioc,"Maunier, Elie (1866-19..) ",Les plantes à parfums des colonies françaises,1932,"Marseille : Institut colonial, 2e ed.",,Cochinchine,http://www.manioc.org/patrimon/FRA12344,,"/JPL 6,13, 26, 44, 45, 48, 49, 50, 55, 58,70"
nui_sou_00006,archives,manioc,,Flora brasiliensis : enumeratio plantarum in Brasilia hactenus detectarum quas suis aliorumque botanicorum studiis descriptas et methodo naturali digestas partim icone illustratas….,1840-1906,Monachii ; Lipsiae : apud Frid. Fleischer in comm.,,Brésil,http://www.manioc.org/patrimon/TLS17055 et  TLS17055 à 94,"// En latin ; Capraria biflora p 294,  334,  337 V8 part1 ; Ocimum gratissimum p 71, 223, 217 v8 part 1 ; Psidium guayava p 396 v 14 part 1.2 ; Eryngium foedidum p 312 v 11 part 1 ; Petiveria alliacea p 332 v 14 part 2 ; Portulaca oleracae p 299 v 14 part 2","/JPL 13, 26, 44, 45, 48, 49, 50, 55, 59"
nui_sou_00007,archives,manioc,"Hahn, M.L. ()",Manuel du bon jardinier aux Antilles,1880,"Saint-Pierre, Martinique : Impr. Hte Durieu",,Antilles,http://www.manioc.org/patrimon/ADG18183,"// plantes mentionnées, mais intérêt faible pour notre étude","/JPL 6,13, 26, 44, 45, 48, 49, 50, 55, 58, 70"
nui_sou_00008,archives,manioc,"Lanessan, de, Jean-Marie Antoine Louis (1843-1919)",Les plantes utiles des colonies françaises,1886,Ministère de la marine et des colonies,Martinique,"Guadeloupe, Guyane, Cochinchine, Tahiti, Sénégal",http://www.manioc.org/patrimon/FCL18019,,"/JPL 6, 13, 26, 44, 45, 48, 49, 50, 55, 58, 70"
nui_sou_00009,archives,manioc,"Devez, G. ()",Exposition universelle de 1900 : Notice sur la Guyane Française,1900,,,Guyane,http://www.manioc.org/patrimon/FRA11058 ;,,
nui_sou_00010,archives,manioc,,Notice sur la Guyane,1900,,,Guyane,http://www.manioc.org/patrimon/FRA11067,,
nui_sou_00011,archives,manioc,,Catalogue des produits des colonies françaises envoyés à l'exposition universelle de Londres de 1862,1862,Paris : Librairie Challamel Ainé,,,http://www.manioc.org/patrimon/FRA11186,"// plantes mentionnées, mais intérêt faible pour notre étude (donne un nom vernaculaire et parfois une propriété)","/JPL 7, 13, 26, 44, 45, 48, 49, 50, 55, 58, 70"
nui_sou_00012,archives,manioc,"Rivière, Léon ()","La Guyane française en 1865 : aperçu géographique, historique, législatif, agricole, industriel et commercial",1866,,,Guyane,http://www.manioc.org/patrimon/FRA11102,,
nui_sou_00013,archives,manioc,"Drouer, Henri (1829-1900)",Essai sur les mollusques terrestres et d'eau douce de la Guyane française,1859,,,Guyane,http://www.manioc.org/patrimon/HASH0d7a3c0a8e1e38910b7666,,
nui_sou_00014,archives,manioc,"Barerre,  ()","Essai sur l'histoire naturelle de la France équinoxiale, ou Dénombrement des plantes, des animaux, & des minéraux, qui se trouvent dans l'isle de Cayenne, les isles de Remire, sur les côtes de la mer, & dans le continent de la Guyane : avec leurs noms différens, latins, françois, et indiens, et quelques observations sur leur usage dans la médecine & dans les arts",1741,,,Guyane,http://www.manioc.org/patrimon/FRA11085,,
nui_sou_00015,archives,article Lozere,"Roques, Joseph ()","Plantes usuelles, indigènes et exotiques, dessinées et coloriées d'après nature, avec la description de leurs caractères distinctifs et de leurs propriétés médicinales",1807-1808,"A Paris Chez l'auteur, rue des filles-Saint-Thomas n° 17 et chez Madame veuve Hocquart, libraire, rue de l'Eperon, n° 6, près celle St-André-des-Arcs. 1807-1808 (De l'imprimerie L.-P. Dubray, rue Ventadour, n.o 5) ; 2 v.",,caraïbe,https://tolosana.univ-toulouse.fr/notice/051523272,,"/JPL 13, 26, 44, 45, 48, 49, 50, 55, 58"
nui_sou_00016,archives,article Lozere,"Tussac, de, François Richard (1786-1827)","Flore des Antilles, ou Histoire générale, botanique, rurale et économique des végétaux indigènes des Antilles, et des exotiques que l'on est parvenu à y Naturaliser",1808-1827,(Paris) ; 4 v.,,Antilles ; Saint-Domingue,https://gallica.bnf.fr/services/engine/search/sru?operation=searchRetrieve&version=1.2&collapsing=disabled&rk=42918;4&query=dc.relation%20all%20%22cb315073048%22,,"/JPL 13, 26, 44, 45, 48, 49, 50, 55, 58"
nui_sou_00017,archives,article Lozere,"Descourtilz, Michel-Étienne ()",Voyages d’un naturaliste et ses observations faites sur les trois règnes de la Nature,1809,Paris : Dufart père ; 3 v.,,Caraïbe ; Saint-Domingue,http://www.manioc.org/patrimon/SCH13036 ; et SCH13037 à 38,,"/JPL 13, 26, 44, 45, 48, 49, 50, 55, 58"
nui_sou_00018,archives,article Lozere,"Descourtilz, Michel-Étienne ()",Manuel indicateur des plantes usuelles des Antilles,non daté,,,Antilles,,// pas vu en ligne,
nui_sou_00019,archives,article Lozere,"Chaumeton, Françoise Pierre  (1775-1819); 
Poiret, Jean-Louis-Marie (1755-1834)",Flore médicale,1833,,,Caraïbe,https://www.biusante.parisdescartes.fr/histoire/medica/resultats/index.php?do=livre&cote=37591x01,,
nui_sou_00020,archives,article Lozere,"Réveil, Oscar (1821-1865); 
Dupuis, Aristide () ; 
Gérard, Frédéric ()","Le Règne végétal divisé en traité de botanique générale, flore médicale et usuelle, horticulture botanique et pratique... histoire biographique et bibliographique de la botanique",1864- 1869,,,Caraïbe,https://archive.org/details/lergnevgta01rv/page/n9/mode/2up,,
nui_sou_00021,archives,article Lozere,"Dujardin-Beaumetz, Georges (1833-1895)","Les plantes médicinales indigènes et exotiques leurs usages thérapeutiques, pharmaceutiques et industriels avec 1034 figures dans le texte",1889,,,Caraïbe,https://gallica.bnf.fr/ark:/12148/bpt6k61413605/f7.item#,,
nui_sou_00022,archives,article Lozere,"Py, Athanase ()",Flore des Antilles,1892,,,Antilles,https://tolosana.univ-toulouse.fr/fr/notice/115893741,"// doc manuscrit, pas de OCR",
nui_sou_00023,archives,article Lozere,"Losh, Friedrich ()","Les Plantes médicinales, atlas colorié des plantes médicinales, atlas colorié des plantes (86 Planches)",1908,,,Caraïbe,https://gallica.bnf.fr/ark:/12148/bpt6k5852537p.texteImage#,,
nui_sou_00024,archives,article Lozere,"Merian, Anna Maria Sibylla ()",Metamorphosis insectorum Surinamensium.,1705,,,Surinam,https://www.biodiversitylibrary.org/item/129308#page/33/mode/thumb,// langue étrangère (néerlandais?),
nui_sou_00025,archives,article Lozere ; manioc,"Pouppé-Desportes, Jean-Baptiste René ()","Histoire des Maladies de Saint-Domingue, Traité ou abrégé des plantes usuelles à Saint-Domingue",1770,,,Saint-Domingue,http://www.manioc.org/patrimon/MMC16024-1,,
nui_sou_00026,archives,article Lozere,"Turpin, Pierre-François (1775-1840)",,,,,Saint-Domingue,,"// plusieurs ouvrages sur BNF mais pas forcément consacré aux Antilles, il est passé par Saint-Domingue, éléement de notice biblio ici https://www.persee.fr/doc/pharm_0035-2349_2008_num_95_359_6506",
nui_sou_00027,archives,article Lozere,"Poiteau, Pierre-Antoine (1766-1854)",,,,,Saint-Domingue,,"//Plusieurs ouvrages sur BNF mais pas forcément sur les Antilles, a bossé avec Turpin dans le traité des arbres fruitiés  wiki "" Il fait paraître, en 1808 à Paris, avec Pierre Jean François Turpin (1775-1840), qu'il a rencontré à Haïti, Flora Parisiensis secundum systema sexuale deposita et plantarum circa Lutetiam sponte nascentium descriptiones, icones.""",
nui_sou_00028,biblio,article Lozere,"Allain, Y. M. ()","Passions botaniques : Naturalistes voyageurs au temps des grandes découvertes,",2008,"Rennes : Éd. ""Ouest-France"", DL, 191 p.",,,,,
nui_sou_00029,biblio,article Lozere,"Allorge, L. ()","La fabuleuse odyssée des plantes, les botanistes voyageurs, les jardins des plantes, les herbiers",2003,"Paris : J. C. Lattès, 727 p.",,,,,
nui_sou_00030,biblio,article Lozere,"Schnapper, Antoine ()","Le géant, la licorne, la tulipe. Histoire et Histoire naturelle",1988,"Flammarion, 1988, 415 p",,,,,
nui_sou_00031,biblio,article Lozere,"Lamy, D. ()",« Le savoir botanique par les herbiers : une permanence du travail des cabinets »,2005,"Actes du colloque Voyages en Botanique, Besançon : ACCOLADE, en ligne.",,,,,
nui_sou_00032,archives,calames ; Bibliothèque numérique du MNHN,"Plumier, Charles (1646-1704)","Solum, salum, cœlum americanum, seu plantarum, piscium, volucrumque insulis Antillanis et Sandominicana naturalium icones et descriptiones",16..,"MNHN, Ms 23",Martinique,Antilles ; Saint-Domingue,https://bibliotheques.mnhn.fr/medias/doc/EXPLOITATION/IFD/MNHN_MS23/solum-salum-cœlum-americanum-seu-plantarum-piscium-volucrumque-insulis-antillanis-et-sandominicana-n,,
nui_sou_00033,archives,calames ; Bibliothèque numérique du MNHN,"Chanvallon, Jean-Baptiste Thibaut de (1723-1788)","Observations d'histoire naturelle, faites à la Martinique",1751-1756,"MNHN, Ms 690",Martinique,Antilles,https://bibliotheques.mnhn.fr/medias/doc/EXPLOITATION/IFD/MNHN_MS690/observations-d-histoire-naturelle-faites-a-la-martinique-par-jean-baptiste-thibaut-de-chanvallonn,,
nui_sou_00034,archives,calames,"Vaillant, Sébastien (1669-1722); 
Plumier, Charles (1646-1704 )","Catalogue des plantes que le Père Plumier a observées dans les Isles Antilles, selon l'ordre des volumes du Botanicum Americanum",XVIIe-XVIIIe siècle,"MNHN, Ms 34",,Antilles,https://bibliotheques.mnhn.fr/EXPLOITATION/infodoc/digitalCollections/viewerpopup.aspx?seid=MNHN_MS9,,
nui_sou_00035,archives,calames,"Plumier, Charles (1646-1704)",De naturalibus Antillarum,1689,"MNHN, Ms 35",,Antilles ; Saint-Domingue,,,
nui_sou_00036,archives,calames ; Bibliothèque numérique du MNHN,"Vaillant, Sébastien (1669-1722);
Plumier, Charles (1646-1704 )","Catalogue des plantes que le Père Plumier a observées dans les îles Antilles, classées selon l'ordre alphabétique, par Vaillant",XVIIe-XVIIIe siècle,"MNHN, Ms 9",,Antilles,https://bibliotheques.mnhn.fr/medias/doc/EXPLOITATION/IFD/MNHN_MS9/catalogue-des-plantes-que-le-pere-plumier-a-observees-dans-les-iles-antilles-classees-selon-l-ordre-,,
nui_sou_00037,archives,calames,"Le Breton, Adrien (1662-1736)","Traité des plantes qui croissent dans les isles karaybes de la Dominique et de Saint-Vincent, selon l'ordre alphabétique, ou herbier Karaybe",XVIIIe siècle,"MNHN, Ms 937-938",,Dominique ; Saint-Vincent,https://bibliotheques.mnhn.fr/medias/doc/EXPLOITATION/IFD/MNHN_MS937-938/pere-le-breton-jesuite-traite-des-plantes-qui-croissent-dans-les-isles-karaybes-de-la-dominique-et-d,,
nui_sou_00038,archives,calames,"Le Breton, Adrien (1662-1736)","Description des plantes de l'Amérique, par le Père Le Breton, avec une lettre de ce religieux",1704,"MNHN, Ms 667",,Antilles,,,
nui_sou_00039,archives,calames,"Le Breton, Adrien (1662-1736)","Observations sur quelques plantes de l'Amérique, avec des descriptions et quelques figures envoyées à Messieurs Fagon, premier médecin de Louis XIV, roy de France, et Raudot, par le R. P. Le Breton, missionnaire apostolique de la Compagnie de Jésus, du Cap françois de Saint-Domingue ",1715,"MNHN, Ms 668",,Antilles ; Saint-Domingue,,,
nui_sou_00040,archives,calames,"Richard, Achille (1794-1852)","Florula Antillana, sive enumeratio plantarum quae in diversis Antillarum insulis crescunt",1838-1841,"MNHN, Ms 974-975",,Antilles,,,
nui_sou_00041,archives,calames,"Richard, Louis-Claude (1754-1821)","Catalogus plantarum in Guyanna et Antillis collectarum a Ludovico-Claudio Richard, a fine anni 1781 ad medium annum 1789. Parisiis, ineunte anno 1790",1790,"MNHN, Ms 1320",,Antilles ; Guyane,,,
nui_sou_00042,archives,calames,"Richard, Louis-Claude (1754-1821)",Carnets de notes de voyage aux Antilles - Miscellanea Martinicae,1787-1788,"MNHN, Ms 1608",,Martinique,,,
nui_sou_00043,archives,calames,"Le Breton, Adrien (1662-1736)",De insulis Karaybicis relationes manuscriptae,1722,"MNHN, Ms 939",,Antilles ; Saint-Vincent,,,
nui_sou_00044,archives,calames,"Plumier, Charles (1646-1704)","Historia plantarum per Americanas insulas, annis 1689-1697 observatarum a R. P. Car. Plumier, inedita, partem primam a Burmanno editam continuans, ex auctoris manuscriptis in bibliotheca Musaei Parisiensis asservatis, transcripta manu Ant. de Jussieu",XVIIIe siècle,"MNHN, Ms 979",,Antilles,,,
nui_sou_00045,archives,calames,"Descourtilz, Michel-Étienne ()","Extrait de l'examen de la deuxième livraison de la Flore médicale des Antilles de M. Descourtilz, relatif à la fleur de paradis et à l'analyse chimique de ses fleurs, par J.B. Ricord",XVIIIe siècle,"BIU Santé - Pôle Pharmacie, Reg. 53, pièce 49",,,,,
nui_sou_00046,archives,calames ; Bibliothèque numérique du MNHN,"Plumier, Charles (1646-1704)",Botanographia americana,1693,"MNHN, Ms 28",,Antilles,https://bibliotheques.mnhn.fr/medias/doc/EXPLOITATION/IFD/MNHN_MS28/botanographia-americana,,
nui_sou_00047,archives,calames,"Leroy de la Potherie, Charles-Auguste (1702-1782)","Collection des fruits des Isles sous le vent de l'Amérique, des plantes qui en forment les revenus, de celles qui servent à la subsistance des habitants du pays et l'énumération des différentes ressources que fournissent les rivières, les étangs, la mer et le sol de la terre, pour la vie et la bonne chère",1764,"Mazarine, Fonds Châtillon, Ant Ms 5",,Antilles,https://mazarinum.bibliotheque-mazarine.fr/ark:/61562/mz2691,,
nui_sou_00048,archives,calames ; Bibliothèque numérique du MNHN,"Chanvallon, Jean-Baptiste Thibaut de (1723-1788)",Recueil de dessins de plantes et animaux de la Martinique,XVIIIe siècle,"MNHN, Ms 1338",Martinique,Antilles,https://bibliotheques.mnhn.fr/medias/doc/EXPLOITATION/IFD/MNHN_MS1338/recueil-de-dessins-de-plantes-et-animaux-de-la-martinique-par-j-b-thibaut-de-chanvalon,,
nui_sou_00049,archives,calames ; Bibliothèque numérique du MNHN,"Plumier, Charles (1646-1704)","Filicetum americanum, seu historia filicum in insulis americanis nascentium",1703,"MNHN, Ms 1",,Antilles,1660-1732,,
nui_sou_00050,archives,calames ; Bibliothèque numérique du MNHN,"Plumier, Charles (1646-1704)","Botanicum americanum, seu historia plantarum in americanis insulis nascentium.",1689-1697,"MNHN, Ms 2-7",,Antilles,"https://bibliotheques.mnhn.fr/medias/doc/EXPLOITATION/IFD/MNHN_MS2/botanicum-americanum-seu-historia-plantarum-in-americanis-insulis-nascentium-ab-anno-1689-usque-ad-a
https://bibliotheques.mnhn.fr/medias/doc/exploitation/IFD/MNHN_MS3/botanicum-americanum-seu-historia-plantarum-in-americanis-insulis-nascentium-ab-anno-1689-usque-ad-a 
https://bibliotheques.mnhn.fr/medias/doc/EXPLOITATION/IFD/MNHN_MS4/botanicum-americanum-seu-historia-plantarum-in-americanis-insulis-nascentium-ab-anno-1689-usque-ad-a 
https://bibliotheques.mnhn.fr/medias/doc/EXPLOITATION/IFD/MNHN_MS5/botanicum-americanum-seu-historia-plantarum-in-americanis-insulis-nascentium-ab-anno-1689-usque-ad-a 
https://bibliotheques.mnhn.fr/medias/doc/EXPLOITATION/IFD/MNHN_MS6/botanicum-americanum-seu-historia-plantarum-in-americanis-insulis-nascentium-ab-anno-1689-usque-ad-a 
https://bibliotheques.mnhn.fr/medias/doc/EXPLOITATION/IFD/MNHN_MS7/botanicum-americanum-seu-historia-plantarum-in-americanis-insulis-nascentium-ab-anno-1689-usque-ad-a ",,
nui_sou_00051,archives,calames ; Bibliothèque numérique du MNHN,"Plumier, Charles (1646-1704)","Herbier d'Amérique, du père Plumier",XVIIIe siècle,"MNHN, Ms 37",,Antilles,,,
nui_sou_00052,archives,calames ; Bibliothèque numérique du MNHN,"Plumier, Charles (1646-1704)",Botanographia americana,XVIIe-XVIIIe siècle,"MNHN, Ms 21",,Antilles,https://bibliotheques.mnhn.fr/medias/doc/EXPLOITATION/IFD/MNHN_MS21/botanographia-americana,// comporte uniquement des planches avec le nom,
nui_sou_00053,archives,calames ; Bibliothèque numérique du MNHN,"Plumier, Charles (1646-1704)","Botanicum americanum, seu historia plantarum in Americanis insulis nascentium, authore R. P. Carolo Plumier",XVIIe siècle,"MNHN, Ms 1335",,Antilles,https://bibliotheques.mnhn.fr/EXPLOITATION/infodoc/digitalCollections/viewerpopup.aspx?seid=MNHN_MS6,,
nui_sou_00054,archives,calames ; Bibliothèque numérique du MNHN,"Plumier, Charles (1646-1704)",Icones plantarum ex America. Autore Padre Carolo Plumier minimo botanico regio,XVIIe-XVIIIe siècle,"MNHN, Ms Res 3355",,Antilles,,,
nui_sou_00055,archives,calames,"Le Breton, Adrien (1662-1736)","Observations du R. P. Le Breton, de la Compagnie de Jésus, sur quelques plantes des isles de l'Amérique, décrites par Guillaume Pison",XVIIIe siècle,"MNHN, Ms 63",,Antilles,,,
nui_sou_00056,biblio,sudoc,"Hatzenberger, Françoise ()",Paysages et végétations des antilles,2001,,,Antilles,,,"/BR 55, 56"
nui_sou_00057,archives,gallica,"Du Tertre, Jean-Baptiste (1610-1687)","Histoire générale des isles de S. Christophe, de la Guadeloupe, de la Martinique et autres dans l’Amérique",1654,,,Antilles,https://gallica.bnf.fr/ark:/12148/bpt6k87173031,,
nui_sou_00058,archives,gallica,"Du Tertre, Jean-Baptiste (1610-1687)",Histoire générale des Antilles habitées par les Français,1667-1671,,,Antilles,"https://gallica.bnf.fr/ark:/12148/bpt6k1140206
https://gallica.bnf.fr/ark:/12148/bpt6k114021k
https://gallica.bnf.fr/ark:/12148/bpt6k114022z",,"/BR 55, 56, 70"
nui_sou_00059,archives,gallica,"Rochefort, Charles de (1605-1683)",Histoire naturelle et morale des îles Antilles de l’Amérique,"1658, 1665, 1667, 1681",,,Antilles,https://gallica.bnf.fr/ark:/12148/bpt6k15205546,,
nui_sou_00060,archives,gallica,"Rufz de Lavison, Etienne (1806-1884)","Enquête sur le serpent de la Martinique : vipère fer de lance, bothrops lancéolé, etc.",1859,Paris,Martinique,,https://gallica.bnf.fr/ark:/12148/bpt6k55684741,,
nui_sou_00061,archives,Northeastern University,"Bourgeois, Nicolas-Louis ();
Nougaret, Pierre-Jean-Baptiste ()","Voyages intéressants dans différentes colonies françaises, espagnoles, anglaises, etc",1788,Paris : Jean-François Bastein,,Antilles,http://hdl.handle.net/2047/D20396968,,
nui_sou_00062,archives,Northeastern University,"Sloane, Hans (1660-1753)","A voyage to the islands Madera, Barbados, Nieves, St Christophers and Jamaica with the natural history of the herbs, and trees...",1725,London : printed for the author,,Jamaique,http://hdl.handle.net/2027/ucm.5326679165,,
nui_sou_00063,biblio,réseaux sociaux," Nossin, Emmanuel",Pharmacopée martiniquaise traditionnelle,2021,Paris : Scitep Éditions,Martinique,,,,DR 1 à 20
nui_sou_00064,archives,maison DR,"Longin, Felix (1787-1822) ","Voyage à la Guadeloupe, (1816-1822)",1848,Société d'histoire de la Guadeloupe,,Guadeloupe,SHG,,
nui_sou_00065,biblio,Dubost Isabelle,"Dubost, isabelle","""De soi aux autres. . . Un parcours périlleux : la construction d'un territoire par les pêcheurs martiniquais"", ",1996,"Université de Toulouse 2,",Martinique,,,,
nui_sou_00066,biblio,Dubost Isabelle,"Benoît, Catherine","Les frontières du corps : perception du corps à la Guadeloupe à travers les représentations et pratiques liées à la maladie, l'espace habité (case et jardin de case) et l'exercice des thérapeutiques traditionnelles",1989,Paris EHESS,,Guadeloupe,,,
nui_sou_00067,biblio,dubost,"Benoît, Catherine","Corps, jardins, mémoires. Anthropologie du corps et de l'espace à la Guadeloupe"", aux ",2000,éditions du CNRS et de la Maison des Sciences de l'Homme,,,à consulter en bibliothèque,"très intéressant, mais ne donne pas d'éléments de posologie fine en matière médicinale, cosmétique ou alimentaire",
nui_sou_00068,biblio,tareau,"Nossin, Emmanuel","Plantes magiques de Martinique, Guadeloupe et des Petites Antilles,",2019,"André Exbrayat, Exbrayat Eds.",Martinique,Guadeloupe et petites Antilles,,,
nui_sou_00069,archives,"BDD-Caribbean History and Culture, 1535-1920","Charlevoix, Pierre-François-Xavier de (1682-1761)"," Histoire de l'Isle espagnole ou de S. Domingue : ecrite particulierement sur des memoires manuscrits du P. Jean-Baptiste le Pers, jesuite, missionnaire à Saint Domingue, & sur les pieces originales, qui se conservent au dépôt de la marine Par le P. Pierre-François-Xavier de Charlevoix, de la compagnie de Jesus. ",1730,Paris,,Saint-Domingue,,// accès restreint aux abonnés https://infoweb-newsbank-com.bu-services.univ-antilles.fr/iw-search/we/Evans/?p_product=EAIX&p_theme=eai&p_nbid=B5EP48FDMTY1MDk3ODUyNC41MjQ0ODI6MToxMzoxOTQuMTk5Ljk4LjY2&p_action=doc&p_docnum=8&p_queryname=7&p_docref=v2:13D59FCC0F7F54B8@EAIX-157975D152C61B48@2213-@1&f_content=image,/JPL 55
nui_sou_00070,archives,manioc,"Browne, Patrick (1720-1790)",The civil and natural History of Jamaica. In three parts...,1756,London : printed for the author,,Jamaïque,http://www.manioc.org/patrimon/BBX17028,,/JPL 55
nui_sou_00071,archives,manioc,"Fermin, Philippe (1720-1790)","Histoire naturelle de la Hollande équinoxiale ou description des animaux, plantes, fruits et autres curiosités naturelles...",1765,non renseigné,,Surinam,http://www.manioc.org/patrimon/HASH924cecb66bfa21fd5d97b3,,/JPL 55
nui_sou_00072,archives,manioc,"Pobéguin, Henri (1856-1951) ",Plantes médicinales de la Guinée française,1911,dans Etudes et mémoires,,Guinée française,http://www.manioc.org/patrimon/FRA11050,,/JPL 55
nui_sou_00073,archives,BDD-Caribbean News Paper 1718-1816,,Grenada Free Press; and Weekly Gazette (published as The Grenada Free Press),1832,"St. George's, Grenada, 28 novembre, n°355",,Grenada,,// accès restreint aux abonnés  https://infoweb-newsbank-com.bu-services.univ-antilles.fr/apps/readex/doc?p=EANACN&docref=image/v2%3A145FA089AAAC15D4%40EANACN-14E8BD75766E0948%402390516-14E32B6E532EF320%402-14E32B6E532EF320%40.,/JPL 55
nui_sou_00074,bibliographie,BNF,"Bourdier, Karen","Vie quotidienne et conditions sanitaires à Saint-Domingue, les sucreries du Nord à la veille de l'insurrection de 1791",2019,"la Rochelle, Les Indes savantes, ",,partie française Saint-Domingue,,,
nui_sou_00075,bibliographie,BNF,"Schiebinger, Londa",Secret cures of slaves,2017,stanford university press,,,,,
nui_sou_00076,bibliographie,BNF,"Gomez, Pablo F.",the experiential caribbean,2017,chapel hill,,,,,
nui_sou_00077,bibliographie,BNF,Chevalier Auguste ,"""Ce que l'Amérique a donné à l'Ancien Monde"" (Suite et fin).. .",1936,"Revue de botanique appliquée et d'agriculture coloniale, 16ᵉ année, bulletin n°178, juin 1936. pp. 417-441",,AMérique,https://www.persee.fr/doc/jatba_0370-3681_1936_num_16_178_5631,,
nui_sou_00078,bibliographie,BNF,"Nossin, Emmanuel","Plantes magiques de Martinique, Guadeloupe et des Petites Antilles,",2012,"André Exbrayat, Exbrayat Eds.",Martinique , Guadeloupe,à consulter en bibliothèque,,
nui_sou_00079,Archives,Gallica,M. Dubry,"Médecine à Saint-Domingue, Manière d'administrer la liqueur savoneuse (sic) américaine de M. Dubry, maître en chirurgie, ancien-chirurgien major des armées du roi, ci-devant inspecteur des eaux minérales de Boynes, résidant au Cap-français, isle et coste de Saint-Domingue",,,,,,,
nui_sou_00080,Archives,Gallica,"Baillon, Henri (1827-1895) ",Dictionnaire de Botanique,1876-1892,"Paris, Hachette et cie",,Monde,,"éléments sur la noix de cajou, l'alpinia,",
nui_sou_00081,Archives,ouvrage  AIHP-GEODE,"Bodart, Pierre-Henry Hippolyte (1758-1826)",Tableau des plantes médicinales exotiques et de leurs succedanées indigènes,1815,"Paris, Méquignon",,,,,
nui_sou_00082,bibliographie,ouvrage  AIHP-GEODE,Dousset J.C. ,Histoire des médicaments des origines à nos jours,1985,"Paris, PAyot",,,,,
nui_sou_00083,Archives,ouvrage  AIHP-GEODE,Laubert C-J. et Merat F.V. ,Dictionnaire des sciences médicales  ,1820,"Paris, Pancoucke",,,,,
nui_sou_00084,bibliographie,ouvrage  AIHP-GEODE,Lecourt,Dictionnaire de la Pensée médicale,2004,"Paris, Quadrige",,,,,
nui_sou_00085,Archives,ouvrage  AIHP-GEODE,Peysson,"""Nouveaux remèdes fébrifuges"" ",1822,"in Nouveau Journal de médecine, de chirurgie et d epharamacie",,,,,
